[
  {
    "id": "pbp1",
    "name": "Sam Slate",
    "role": "pbp",
    "skill": 78,
    "brand_fit": 80,
    "chemistry_map": {
      "col1": 72
    }
  },
  {
    "id": "col1",
    "name": "Rex Riot",
    "role": "color",
    "skill": 74,
    "brand_fit": 70,
    "chemistry_map": {
      "pbp1": 72
    }
  }
]